{
  "colours": {
    "accent": "#89b4fa",
    "background": "#242424",
    "border": "#3b3c4a",
    "danger": "#f38ba8",
    "foreground": "#cdd6f4",
    "info": "#89b4fa",
    "mauve": "#f5c2e7",
    "muted": "#a6adc8",
    "selection_background": "#89b4fa",
    "selection_foreground": "#1e1e1e",
    "success": "#a6e3a1",
    "surface": "#1e1e1e",
    "surface_alt": "#3b3c4a",
    "teal": "#94e2d5",
    "warning": "#f9e2af"
  },
  "cursor": {
    "base": "Bibata-Modern-Classic",
    "base_colour": "#89b4fa",
    "colour_source": "theme",
    "handedness": "right",
    "mode": "generated",
    "outline_colour": "#1e1e1e",
    "sizes": [
      22,
      24
    ],
    "watch_background": "#242424"
  },
  "fonts": {
    "editor_size": 13,
    "gtk_size": 11,
    "mono": "MartianMono Nerd Font Mono",
    "panel": "MartianMono Nerd Font Propo",
    "terminal_size": 12,
    "ui": "Google Sans"
  },
  "gtk": {
    "base_theme": "Graphite-Dark-compact",
    "colour_source": "theme",
    "mode": "generated"
  },
  "icons": {
    "theme": "Adwaita"
  },
  "id": "blox-panel",
  "name": "Default",
  "schema_version": 1,
  "shell": {
    "bar": {
      "items": [
        {
          "enabled": true,
          "id": "workspaces",
          "order": 0,
          "region": "start"
        },
        {
          "enabled": true,
          "id": "notes",
          "order": 1,
          "region": "start"
        },
        {
          "enabled": true,
          "id": "clock",
          "order": 0,
          "region": "centre"
        },
        {
          "enabled": true,
          "id": "tray",
          "order": 0,
          "region": "end"
        },
        {
          "enabled": true,
          "id": "sound",
          "order": 1,
          "region": "end"
        },
        {
          "enabled": true,
          "id": "fan",
          "order": 2,
          "region": "end",
          "visibility": "normal"
        },
        {
          "enabled": true,
          "id": "gpu",
          "order": 3,
          "region": "end",
          "visibility": "normal"
        },
        {
          "enabled": true,
          "id": "touchpad",
          "order": 4,
          "region": "end",
          "visibility": "normal"
        },
        {
          "display": "numeric",
          "enabled": true,
          "id": "battery",
          "order": 5,
          "region": "end"
        },
        {
          "enabled": true,
          "id": "power",
          "order": 6,
          "region": "end"
        },
        {
          "enabled": true,
          "id": "application-tray",
          "order": 0,
          "region": "hidden"
        },
        {
          "enabled": true,
          "id": "privacy",
          "order": 1,
          "region": "hidden"
        },
        {
          "enabled": true,
          "id": "awake",
          "order": 2,
          "region": "hidden"
        },
        {
          "enabled": true,
          "id": "display",
          "order": 3,
          "region": "hidden"
        },
        {
          "enabled": true,
          "id": "bt",
          "order": 4,
          "region": "hidden"
        },
        {
          "enabled": true,
          "id": "wifi",
          "order": 5,
          "region": "hidden"
        },
        {
          "enabled": true,
          "id": "updates",
          "order": 6,
          "region": "hidden"
        },
        {
          "enabled": true,
          "id": "notifications",
          "order": 7,
          "region": "hidden"
        }
      ],
      "position": "top"
    },
    "notifications": {
      "offset_x": 0,
      "offset_y": 0,
      "position": "top-right"
    },
    "osd": {
      "offset_x": 0,
      "offset_y": 0,
      "position": "centre-top"
    }
  },
  "targets": {
    "btop": true,
    "code": false,
    "cursor": true,
    "cursor_editor": true,
    "glow": true,
    "grub": false,
    "gtk": true,
    "hyprland": true,
    "hyprlock": true,
    "kitty": true,
    "micro": true,
    "obsidian": true,
    "powerlevel10k": true,
    "quickshell": true,
    "sddm": false,
    "stylus": true,
    "vicinae": true,
    "wallpaper": true,
    "widgets": true
  },
  "terminal": {
    "ansi_source": "derived",
    "canvas": "#000000",
    "chrome_background": "#242424"
  },
  "variant": "dark",
  "wallpaper": {
    "fit": "cover",
    "path": "~/Pictures/wallpapers/2022-07-07_18.12.55.png"
  },
  "widgets": {
    "items": [
      {
        "anchor": "top-left",
        "content_command": "pipes.sh",
        "enabled": false,
        "height": 0,
        "id": "widget-7",
        "interval_ms": 60000,
        "left_click_command": "",
        "name": "New widget",
        "offset_x": 20,
        "offset_y": 20,
        "options": {
          "auto_size": true,
          "scale": 1
        },
        "right_click_command": "",
        "shape": "auto",
        "type": "pipes",
        "visibility": "empty-workspace",
        "width": 0
      },
      {
        "anchor": "top-left",
        "content_command": "cava",
        "enabled": false,
        "height": 0,
        "id": "widget-6",
        "interval_ms": 60000,
        "left_click_command": "",
        "name": "New widget",
        "offset_x": 707,
        "offset_y": 101,
        "options": {
          "auto_size": true,
          "scale": 0.4
        },
        "right_click_command": "",
        "shape": "auto",
        "type": "music",
        "visibility": "empty-workspace",
        "width": 0
      },
      {
        "anchor": "top-right",
        "content_command": "cbonsai -l",
        "enabled": false,
        "height": 0,
        "id": "widget-5",
        "interval_ms": 60000,
        "left_click_command": "",
        "name": "New widget",
        "offset_x": 770,
        "offset_y": 167,
        "options": {
          "auto_size": true,
          "scale": 0.25
        },
        "right_click_command": "",
        "shape": "auto",
        "type": "tree",
        "visibility": "empty-workspace",
        "width": 0
      },
      {
        "anchor": "top-right",
        "content_command": "asciiquarium",
        "enabled": false,
        "height": 0,
        "id": "widget-4",
        "interval_ms": 60000,
        "left_click_command": "",
        "name": "New widget",
        "offset_x": 0,
        "offset_y": 0,
        "options": {
          "auto_size": true,
          "scale": 0.5
        },
        "right_click_command": "",
        "shape": "auto",
        "type": "aquarium",
        "visibility": "empty-workspace",
        "width": 0
      },
      {
        "anchor": "centre",
        "content_command": "tty-clock -t -s -b -B",
        "enabled": false,
        "height": 0,
        "id": "widget-3",
        "interval_ms": 60000,
        "left_click_command": "",
        "name": "coclk",
        "offset_x": 0,
        "offset_y": -450,
        "options": {
          "auto_size": true,
          "blink": true,
          "bold": true,
          "scale": 0.75,
          "seconds": true,
          "twelve_hour": true
        },
        "right_click_command": "",
        "shape": "auto",
        "type": "clock",
        "visibility": "empty-workspace",
        "width": 0
      },
      {
        "anchor": "top-left",
        "content_command": "$SCRIPT_ROOT/widgets/todo-content.sh",
        "enabled": true,
        "height": 0,
        "id": "todo",
        "interval_ms": 60000,
        "left_click_command": "$SCRIPT_ROOT/widgets/cycle-todo.sh",
        "name": "Todo",
        "offset_x": 20,
        "offset_y": 20,
        "options": {
          "scale": 1
        },
        "right_click_command": "$SCRIPT_ROOT/widgets/open-todo-editor.sh",
        "shape": "auto",
        "type": "custom",
        "visibility": "empty-workspace",
        "width": 0
      },
      {
        "anchor": "bottom-right",
        "content_command": "$SCRIPT_ROOT/widgets/gcal-content.sh",
        "enabled": true,
        "height": 0,
        "id": "calendar",
        "interval_ms": 60000,
        "left_click_command": "$SCRIPT_ROOT/widgets/cycle-gcal.sh",
        "name": "Calendar",
        "offset_x": 20,
        "offset_y": 20,
        "options": {},
        "right_click_command": "$SCRIPT_ROOT/widgets/open-gcal.sh",
        "shape": "auto",
        "type": "custom",
        "visibility": "empty-workspace",
        "width": 0
      }
    ],
    "profile": "comfortable"
  }
}
