{
  "colours": {
    "accent": "#89b4fa",
    "background": "#242424",
    "border": "#3b3c4a",
    "danger": "#f38ba8",
    "foreground": "#cdd6f4",
    "info": "#89b4fa",
    "mauve": "#f5c2e7",
    "muted": "#a6adc8",
    "selection_background": "#89b4fa",
    "selection_foreground": "#1e1e1e",
    "success": "#a6e3a1",
    "surface": "#1e1e1e",
    "surface_alt": "#3b3c4a",
    "teal": "#94e2d5",
    "warning": "#f9e2af"
  },
  "cursor": {
    "base": "Bibata-Modern-Classic",
    "base_colour": "#89b4fa",
    "colour_source": "theme",
    "handedness": "right",
    "mode": "generated",
    "outline_colour": "#1e1e1e",
    "sizes": [
      22,
      24
    ],
    "watch_background": "#242424"
  },
  "fonts": {
    "editor_size": 13,
    "gtk_size": 11,
    "mono": "MartianMono Nerd Font Mono",
    "panel": "MartianMono Nerd Font Propo",
    "terminal_size": 12,
    "ui": "Google Sans"
  },
  "gtk": {
    "base_theme": "Graphite-Dark-compact",
    "colour_source": "theme",
    "mode": "generated"
  },
  "icons": {
    "theme": "Adwaita"
  },
  "id": "blox-panel-copy",
  "name": "Default Copy",
  "schema_version": 1,
  "targets": {
    "btop": false,
    "code": false,
    "cursor": true,
    "cursor_editor": false,
    "glow": false,
    "grub": false,
    "gtk": true,
    "hyprland": false,
    "hyprlock": false,
    "kitty": true,
    "micro": false,
    "powerlevel10k": false,
    "quickshell": true,
    "sddm": false,
    "stylus": false,
    "vicinae": true,
    "wallpaper": true,
    "widgets": true
  },
  "terminal": {
    "ansi_source": "derived",
    "canvas": "#000000",
    "chrome_background": "#242424"
  },
  "variant": "dark",
  "wallpaper": {
    "fit": "cover",
    "path": "~/Pictures/wallpapers/2022-07-07_18.12.55.png"
  }
}
