{
  "colours": {
    "accent": "#417292",
    "background": "#121816",
    "border": "#8f9ca5",
    "danger": "#f38ba8",
    "foreground": "#cde0ec",
    "info": "#417292",
    "mauve": "#698fa5",
    "muted": "#8f9ca5",
    "selection_background": "#cde0ec",
    "selection_foreground": "#121816",
    "success": "#a6e3a1",
    "surface": "#121816",
    "surface_alt": "#8f9ca5",
    "teal": "#91a5b4",
    "warning": "#f9e2af"
  },
  "cursor": {
    "base": "Bibata-Modern-Classic",
    "base_colour": "#417292",
    "colour_source": "theme",
    "handedness": "right",
    "mode": "generated",
    "outline_colour": "#121816",
    "sizes": [
      22,
      24
    ],
    "watch_background": "#121816"
  },
  "fonts": {
    "editor_size": 13,
    "gtk_size": 11,
    "mono": "MartianMono Nerd Font Mono",
    "panel": "MartianMono Nerd Font Propo",
    "terminal_size": 12,
    "ui": "Google Sans"
  },
  "generator": {
    "backend": "pywal",
    "mapping_version": 1,
    "options": {
      "mode": "dark"
    },
    "version": "3.3.0",
    "wallpaper_sha256": "5b0142251092766e095f0fd7960ab8fa593d5f980016e091ef6541b726b90d16"
  },
  "gtk": {
    "base_theme": "Graphite-Dark-compact",
    "colour_source": "theme",
    "mode": "generated"
  },
  "icons": {
    "theme": "Adwaita"
  },
  "id": "grass",
  "name": "Grass",
  "schema_version": 1,
  "targets": {
    "btop": true,
    "code": true,
    "cursor": true,
    "cursor_editor": true,
    "glow": true,
    "grub": false,
    "gtk": true,
    "hyprland": true,
    "hyprlock": true,
    "kitty": true,
    "micro": true,
    "powerlevel10k": true,
    "quickshell": true,
    "sddm": false,
    "stylus": true,
    "vicinae": true,
    "wallpaper": true,
    "widgets": true
  },
  "terminal": {
    "ansi_source": "derived",
    "canvas": "#121816",
    "chrome_background": "#121816"
  },
  "variant": "dark",
  "widgets": {
    "profile": "minimal"
  },
  "wallpaper": {
    "fit": "cover",
    "path": "/home/blox/Code/personal/dotfiles/wallpapers/wallpapers/grass.png"
  }
}
