{
  "colours": {
    "accent": "#92cef5",
    "background": "#101417",
    "border": "#8b9198",
    "danger": "#ffb4ab",
    "foreground": "#dfe3e7",
    "info": "#92cef5",
    "mauve": "#b6c9d8",
    "muted": "#c1c7ce",
    "selection_background": "#92cef5",
    "selection_foreground": "#00344b",
    "success": "#ccc1e9",
    "surface": "#1c2024",
    "surface_alt": "#262a2e",
    "teal": "#ccc1e9",
    "warning": "#b6c9d8"
  },
  "cursor": {
    "base": "Bibata-Modern-Classic",
    "base_colour": "#92cef5",
    "colour_source": "theme",
    "handedness": "right",
    "mode": "generated",
    "outline_colour": "#00344b",
    "sizes": [
      22,
      24
    ],
    "watch_background": "#101417"
  },
  "fonts": {
    "editor_size": 13,
    "gtk_size": 11,
    "mono": "MartianMono Nerd Font Mono",
    "panel": "MartianMono Nerd Font Propo",
    "terminal_size": 12,
    "ui": "Google Sans"
  },
  "generator": {
    "backend": "matugen",
    "mapping_version": 1,
    "options": {
      "contrast": 0,
      "mode": "dark",
      "scheme": "scheme-tonal-spot",
      "source_colour_index": 0
    },
    "version": "4.1.0",
    "wallpaper_sha256": "94febd8eb17fb610e954f4fd78b4071a87deac827d2b0d59bf17310a5ec94997"
  },
  "gtk": {
    "base_theme": "Graphite-Dark-compact",
    "colour_source": "theme",
    "mode": "generated"
  },
  "icons": {
    "theme": "Adwaita"
  },
  "id": "moonlight",
  "name": "Moonlight",
  "schema_version": 1,
  "targets": {
    "btop": true,
    "code": true,
    "cursor": true,
    "cursor_editor": true,
    "glow": true,
    "grub": false,
    "gtk": true,
    "hyprland": true,
    "hyprlock": true,
    "kitty": true,
    "micro": true,
    "powerlevel10k": true,
    "quickshell": true,
    "sddm": false,
    "stylus": true,
    "obsidian": true,
    "vicinae": true,
    "wallpaper": true,
    "widgets": true
  },
  "terminal": {
    "ansi_source": "derived",
    "canvas": "#101417",
    "chrome_background": "#101417"
  },
  "variant": "dark",
  "widgets": {
    "profile": "minimal"
  },
  "wallpaper": {
    "fit": "cover",
    "path": "/home/blox/Code/personal/dotfiles/wallpapers/wallpapers/moonlight.png"
  }
}
